channelId,videoId,channelTitle,title,viewCount,likeCount,dislikeCount,favoriteCount,commentCount,durationUC9MAhZQQd9egwWCxrwSIsJQ,bJvmqwP5nZE,HISTORY,The Curse of Oak Island: KNIGHTS TEMPLAR CONNECTION EXPLORED with William Shatner (S7) | History,156597,1494,85,0,223,PT3M54S
UC9MAhZQQd9egwWCxrwSIsJQ,PZsgwt06K2o,HISTORY,Ancient Aliens: HIDDEN ALIEN CODE IN DNA UNCOVERED (Season 13) | History,121169,1935,127,0,278,PT3M19S
UC9MAhZQQd9egwWCxrwSIsJQ,DfzLyuLVTrQ,HISTORY,"Forged in Fire: The Bhuj is SHARP, DEADLY AND STRONG in Final Round (Season 6) | History",899740,9836,282,0,349,PT10M19S
UC9MAhZQQd9egwWCxrwSIsJQ,6nrcz6-u55s,HISTORY,Project Blue Book: The Men in Black Revealed (Season 2) | History,79375,1240,41,0,165,PT5M21S
UC9MAhZQQd9egwWCxrwSIsJQ,UpNbF9gpOMQ,HISTORY,Pawn Stars: Striking a Deal for a Strange Puppet (Season 12) | History,87285,961,39,0,79,PT4M32S
UC9MAhZQQd9egwWCxrwSIsJQ,e5dr285NFoc,HISTORY,Ancient Aliens: METEORITE MESSAGE FROM THE SKY GODS (Season 13) | History,423894,4638,285,0,475,PT3M46S
UC9MAhZQQd9egwWCxrwSIsJQ,Vr7nzvwm2Z4,HISTORY,The First Tuskegee Ace of WWII | Dogfights | History,145820,2260,53,0,212,PT9M
UC9MAhZQQd9egwWCxrwSIsJQ,_SSCVV3hXx8,HISTORY,The UnXplained: What Happens When We Die? (Season 1) | SERIES RETURNS 2/29 at 9/8c | History,75297,1326,89,0,188,PT3M26S
UC9MAhZQQd9egwWCxrwSIsJQ,Hxf7qQNlvTE,HISTORY,The Curse of Oak Island: EVIDENCE OF TUNNELS UNCOVERED (Season 7) | History,279631,1879,125,0,208,PT3M21S
UC9MAhZQQd9egwWCxrwSIsJQ,K4MNwUrbRAs,HISTORY,Ancient Aliens: US SPACE FORCE to Explore Universe (Season 13) | History,206414,3392,213,0,709,PT3M33S
UC9MAhZQQd9egwWCxrwSIsJQ,fJ9wJ3LdnKw,HISTORY,Forged in Fire: Napoleon's Saber LACERATES in FINAL ROUND (Season 6) | History,901280,9621,292,0,375,PT10M47S
UC9MAhZQQd9egwWCxrwSIsJQ,7r5j_sMefkg,HISTORY,Ancient Aliens: THE OCTOPUS FROM OUTER SPACE (Season 12) | Exclusive | History,167738,1998,110,0,235,PT2M56S
UC9MAhZQQd9egwWCxrwSIsJQ,oMYrYm1lWec,HISTORY,Forged in Fire: BLACKBEARD'S CUTLASS ATTACKS THE FINAL ROUND (Season 6) | History,920850,11367,237,0,415,PT10M24S
UC9MAhZQQd9egwWCxrwSIsJQ,WiCpKtkDezk,HISTORY,Vikings: BJORN VS. IVAR IN BRUTAL COMBAT (Season 6) | History,1165111,11812,624,0,2508,PT4M52S
UC9MAhZQQd9egwWCxrwSIsJQ,eXqJPiVdtS4,HISTORY,Forged in Fire: THE FALCHION CUTS THROUGH THE FINAL ROUND (Season 6) | History,3271821,34070,1346,0,1371,PT10M42S
UC9MAhZQQd9egwWCxrwSIsJQ,caaw32758k8,HISTORY,The Battle for Truk Attol (Part 2) | Battle 360 | History,205626,2373,63,0,78,PT4M40S
UC9MAhZQQd9egwWCxrwSIsJQ,rUODOTS8pAg,HISTORY,Swamp People: Troy and Ashley's Gator Hunt (Season 11) | History,106186,1021,56,0,66,PT5M58S
UC9MAhZQQd9egwWCxrwSIsJQ,5wVRjjrvQsM,HISTORY,Ancient Aliens: Mystery of the Betz Sphere (Season 12) | Exclusive | History,150413,1820,76,0,213,PT3M1S
UC9MAhZQQd9egwWCxrwSIsJQ,qTFCF9l5d50,HISTORY,Vikings: Ivar and Hvitserk Plot Revenge (Season 6) | History,540682,4209,105,0,741,PT5M11S
UC9MAhZQQd9egwWCxrwSIsJQ,46_HdtxSBmo,HISTORY,The Curse of Oak Island: FINDING ANSWERS IN THE SWAMP (Season 7) | History,312362,2048,194,0,226,PT3M26S
UC9MAhZQQd9egwWCxrwSIsJQ,lfaYTx2hOFE,HISTORY,Swamp People: Big Gator Rewards for Troy and Terrel (Season 11) | History,72302,687,33,0,23,PT4M34S
UC9MAhZQQd9egwWCxrwSIsJQ,BJOwz3p_TTk,HISTORY,Forged in Fire: Charlemagne's Sword CUTS DEEP (Season 7) | History,876523,10356,283,0,468,PT10M24S
UC9MAhZQQd9egwWCxrwSIsJQ,PLlpD-34cXY,HISTORY,Vikings: Queen Lagertha Joins Ragnar in Valhalla (Season 6) | History,3087433,39442,970,0,3412,PT4M56S
UC9MAhZQQd9egwWCxrwSIsJQ,tN4GQsc-yOY,HISTORY,Vikings: A Funeral Fit For A Shieldmaiden | The Ice Maiden Airs Jan. 15 at 10/9c | History,679450,5737,202,0,580,PT2M23S
UC9MAhZQQd9egwWCxrwSIsJQ,WNHhwaP5fcw,HISTORY,Pawn Stars: ONE-OF-A-KIND SURF BOARD IS VERY EXPENSIVE (Season 12) | History,792354,6181,255,0,565,PT5M7S
UC9MAhZQQd9egwWCxrwSIsJQ,cgbRJfqlQJk,HISTORY,Ancient Aliens: Giorgio Explains the Benben Stones (Season 13) | History,236176,2570,162,0,70,PT3M11S
UC9MAhZQQd9egwWCxrwSIsJQ,4BG7UYGPgts,HISTORY,Forged in Fire: THRUST and SLASH With Attila's Sword of Mars (Season 6) | History,947967,10621,265,0,299,PT10M23S
UC9MAhZQQd9egwWCxrwSIsJQ,vamSFJJiw48,HISTORY,Swamp People: Troy's GIANT GATOR CATCH Ends the Hunt (Season 8) | History,136699,1141,103,0,49,PT4M26S
UC9MAhZQQd9egwWCxrwSIsJQ,FXliSsJIl5A,HISTORY,Vikings: King Harald Sends Assassins After Bjorn (Season 6) | History,424974,2383,97,0,451,PT4M38S
UC9MAhZQQd9egwWCxrwSIsJQ,AEmr_8Op9jU,HISTORY,Forged in Fire: LETHAL and EPIC Broadsword Final Round (Season 7) | History,1754973,19330,552,0,739,PT10M21S
UC9MAhZQQd9egwWCxrwSIsJQ,IPGqTVkcd04,HISTORY,Vikings: Farewell Shieldmaiden | The Ice Maiden Airs Jan. 15 at 10/9c | History,651370,6777,161,0,753,PT2M34S
UC9MAhZQQd9egwWCxrwSIsJQ,G6YnBijnlc8,HISTORY,Vikings: Bjorn Says Goodbye | The Ice Maiden Airs Jan. 15 at 10/9c | History,1025103,13110,233,0,1490,PT2M40S
UC9MAhZQQd9egwWCxrwSIsJQ,jt8fE-vmXBs,HISTORY,The Curse of Oak Island: EXCITING FIND at Shaft 2 (Part 1) | Season 7 | History,282232,1612,89,0,217,PT3M29S
UC9MAhZQQd9egwWCxrwSIsJQ,pqX0a8n5KLk,HISTORY,Pawn Stars: WWII Machine Gets a Tough Appraisal (Season 10) | History,1031563,7130,369,0,323,PT5M1S
UC9MAhZQQd9egwWCxrwSIsJQ,ZnDSckm-0rw,HISTORY,Ancient Aliens: AREA 51 MILITARY TUNNELS (Season 13) | History,252126,2660,132,0,196,PT3M46S
UC9MAhZQQd9egwWCxrwSIsJQ,wzmMAPRCc2M,HISTORY,Forged in Fire: The Chinese War Sword ONE SHOT KILL TEST (Season 7) | History,1542339,15367,506,0,702,PT10M39S
UC9MAhZQQd9egwWCxrwSIsJQ,VeBNCIuFPe8,HISTORY,Vikings: King of All Norway (Season 6) | History,912406,5366,203,0,699,PT5M42S
UC9MAhZQQd9egwWCxrwSIsJQ,sRkyWIFhPf4,HISTORY,Swamp People: Willie Tags Out With Big Gator (Season 8) | History,88420,1006,45,0,51,PT5M30S
UC9MAhZQQd9egwWCxrwSIsJQ,eNFfZ3MU1nQ,HISTORY,Ancient Aliens: Ramanujan's Alien Visions (Season 12) | Exclusive | History,207203,2672,137,0,252,PT2M41S
UC9MAhZQQd9egwWCxrwSIsJQ,IY1y5pSFF48,HISTORY,Mountain Men: Craft with Tom by the Yule Log! | History,78193,870,59,0,71,PT58M8S
UC9MAhZQQd9egwWCxrwSIsJQ,6BovePRYuSE,HISTORY,The Curse of Oak Island: A PATH FORWARD IN THE SWAMP (Season 2) | History,149343,791,64,0,94,PT3M23S
UC9MAhZQQd9egwWCxrwSIsJQ,18oXEzP2Yaw,HISTORY,Forged in Fire: The Ram Dao Final Round: Josh vs Ben (Season 6) | History,1846035,19434,1325,0,698,PT10M14S
UC9MAhZQQd9egwWCxrwSIsJQ,YNQ3LVUo0g8,HISTORY,BRUTAL SCORPIONFISH STING | Kings of Pain (Season 1) | History,503043,7183,442,0,547,PT6M2S
UC9MAhZQQd9egwWCxrwSIsJQ,OIfIvZc92yw,HISTORY,The Battle for Henderson Field: An Astounding US Victory | Battle 360 | History,239158,2606,65,0,216,PT5M22S
UC9MAhZQQd9egwWCxrwSIsJQ,nUzGuPX6WC8,HISTORY,The Curse of Oak Island: EVIDENCE OF TRAPS REVEALED AT SMITH'S COVE (Season 7) | History,398166,2536,139,0,332,PT3M36S
UC9MAhZQQd9egwWCxrwSIsJQ,wJEUnP4BcOg,HISTORY,Pawn Stars: Pawns from a Galaxy Far Far Away | History,312164,2491,107,0,123,PT5M13S
UC9MAhZQQd9egwWCxrwSIsJQ,3sFSDbi5Ufc,HISTORY,Ancient Aliens: Sacred Geometry and the Flower of Life (Season 13) | History,126912,1495,53,0,79,PT3M34S
UC9MAhZQQd9egwWCxrwSIsJQ,TCXFUTVQfJo,HISTORY,American Pickers: Trio of Vintage Fords (Season 21) | History,129932,597,23,0,43,PT5M17S
UC9MAhZQQd9egwWCxrwSIsJQ,WfsmxkzDRDw,HISTORY,CRAZY LIZARD BITE LASTS 10 MINUTES! | Kings of Pain (Season 1) | History,945420,14630,655,0,900,PT6M28S
UC9MAhZQQd9egwWCxrwSIsJQ,GXUF94wX420,HISTORY,The Battle of Santa Cruz: How the US Navy Beat the Odds | Battle 360 | History,215525,2863,86,0,104,PT6M26S
UC9MAhZQQd9egwWCxrwSIsJQ,6kEEt4ic1Lw,HISTORY,Swamp People: WILLIE STAYS STRONG After Tough Year (Season 8) | History,115564,905,38,0,81,PT5M33S
UC9MAhZQQd9egwWCxrwSIsJQ,yxfj7lqiwSw,HISTORY,Vikings: Bjorn's Rescue Mission (Season 6) | History,241245,1434,47,0,272,PT4M15S
UC9MAhZQQd9egwWCxrwSIsJQ,uvZE7hSj53M,HISTORY,Vikings: Ivar Witnesses a Ruthless Power Play (Season 6) | History,551941,4409,144,0,579,PT4M36S
UC9MAhZQQd9egwWCxrwSIsJQ,ZQws41k5U1U,HISTORY,Swamp People: BIG GATORS Are Why Edgars Hunt (Season 8) | History,72062,709,36,0,29,PT5M36S
UC9MAhZQQd9egwWCxrwSIsJQ,Et2Cix65okE,HISTORY,Vikings: Bjorn As King of Kattegat | Two-Hour Season Six Premiere Airs Dec. 4 at 9/8c | History,95522,1141,34,0,178,PT1M9S
UC9MAhZQQd9egwWCxrwSIsJQ,s0XJhixwnPw,HISTORY,American Pickers: Frank Dances for a Deal on a Moto Scooter (Season 3) | History,246669,1136,91,0,48,PT5M44S
UC9MAhZQQd9egwWCxrwSIsJQ,JrTo53xdd8E,HISTORY,BITTEN BY HARVESTER ANTS | Kings of Pain (Season 1) | History,1745786,26591,857,0,554,PT5M25S
UC9MAhZQQd9egwWCxrwSIsJQ,Ev4OV4J9q10,HISTORY,Ancient Aliens: Mysterious Metals from Outer Space (Season 12) | History,283695,3460,164,0,277,PT3M46S
UC9MAhZQQd9egwWCxrwSIsJQ,uWR2Jh2YRWM,HISTORY,Forged in Fire: The Inigo Montoya Rapier Final Round: Ron vs Jesse (Season 7) | History,1386229,15481,439,0,454,PT10M16S
UC9MAhZQQd9egwWCxrwSIsJQ,WoCd1dNMAiM,HISTORY,Forged in Fire Bladesgiving: Top Hunting Weapons | Exclusive | History,141672,1569,61,0,40,PT3M28S
UC9MAhZQQd9egwWCxrwSIsJQ,9hFXASMXn-E,HISTORY,The Curse of Oak Island: AMAZING DISCOVERY Reveals Historic Connection (Season 7) | History,320856,1613,122,0,280,PT3M47S
UC9MAhZQQd9egwWCxrwSIsJQ,-tv8JtM4FzQ,HISTORY,Ancient Aliens: Origins of Osiris Uncovered at Sacred Temple (Season 10) | History,166723,1936,77,0,165,PT3M32S
UC9MAhZQQd9egwWCxrwSIsJQ,5rM_SpLSOwY,HISTORY,American Pickers: Mike is a Man on a Mission for Cycle Car (Season 12) | History,94932,622,19,0,15,PT4M29S
UC9MAhZQQd9egwWCxrwSIsJQ,FfasawhOo6k,HISTORY,UFO Sighting Reported by Hundreds of Witnesses | In Search Of (Season 2) | History,207836,2024,119,0,546,PT5M1S
UC9MAhZQQd9egwWCxrwSIsJQ,mRugHiOboc8,HISTORY,Forged in Fire: Top 5 Short Swords in History Tested | Exclusive | History,421878,5482,120,0,156,PT5M23S
UC9MAhZQQd9egwWCxrwSIsJQ,e4k-Q9vHexY,HISTORY,STUNG BY TWO NASTY SCORPIONS! | Kings of Pain (Season 1) | History,351182,4974,205,0,272,PT5M22S
UC9MAhZQQd9egwWCxrwSIsJQ,Y_8pWO1Qg6k,HISTORY,Forged in Fire: Revolutionary War Spontoon Final Round: Zane vs Chris (Season 7) | History,771383,8262,299,0,381,PT10M19S
UC9MAhZQQd9egwWCxrwSIsJQ,pcENfm6wwAM,HISTORY,Ancient Aliens: Earth's Alien Force Field (Season 10) | History,166971,1839,92,0,323,PT3M26S
UC9MAhZQQd9egwWCxrwSIsJQ,UsE3ID7aygc,HISTORY,Ancient Aliens: Evidence of Alien Wars on Dwarf Planet (Season 10) | History,725688,9511,613,0,870,PT3M29S
UC9MAhZQQd9egwWCxrwSIsJQ,6Lp7RNcITy0,HISTORY,Stolen WWII Gold Found in German Tunnels | In Search Of (Season 2) | History,528102,4682,242,0,360,PT5M23S
UC9MAhZQQd9egwWCxrwSIsJQ,DQvoVGMonKg,HISTORY,BIT BY WORLD'S LARGEST TARANTULA! | Kings of Pain (Season 1) | History,1496172,28639,1982,0,2623,PT7M56S
UC9MAhZQQd9egwWCxrwSIsJQ,S-zI1UTukXI,HISTORY,Forged in Fire: Scottish Backsword Final Round: Robert vs. Billy (Season 7) | History,2624613,26887,1203,0,1173,PT10M20S
UC9MAhZQQd9egwWCxrwSIsJQ,uhLjL2QICIY,HISTORY,The Curse of Oak Island: Astounding Find Reveals New Theory (Season 7) | History,364118,2081,122,0,288,PT3M59S
UC9MAhZQQd9egwWCxrwSIsJQ,_WMzzArjUac,HISTORY,The Curse of Oak Island: REAL TREASURE FOUND at Lot 8 (Season 5) | History,178821,739,79,0,96,PT3M25S
UC9MAhZQQd9egwWCxrwSIsJQ,d6p_0W6pFwU,HISTORY,Swamp People: Giant Gator Catch for Troy and the Boys (Season 8) | History,141212,1196,73,0,51,PT5M40S
UC9MAhZQQd9egwWCxrwSIsJQ,LvSRU_DlJDM,HISTORY,Ancient Aliens: India's Mysterious Caves (Season 9) | History,1467251,13699,982,0,1325,PT5M13S
UC9MAhZQQd9egwWCxrwSIsJQ,LPpWHZafYjA,HISTORY,American Pickers: Huge Lot of Vintage Trucks (Season 7) | History,253885,1480,67,0,106,PT6M57S
UC9MAhZQQd9egwWCxrwSIsJQ,E99mORr0qvE,HISTORY,Quest for The Ark of the Covenant: New Clues Found! | In Search Of (Season 1) | History,364557,4739,231,0,835,PT5M54S
UC9MAhZQQd9egwWCxrwSIsJQ,fWGTDWUh1zo,HISTORY,Swamp People: Willie Puts the Hurt on Some Poachers (Season 8) | History,510861,3208,389,0,141,PT5M19S
UC9MAhZQQd9egwWCxrwSIsJQ,NTLSQCF6ohQ,HISTORY,Unidentified: Naval Pilot's Shocking UFO Encounter (Season 1) | History,3103014,33579,1384,0,3467,PT5M34S
UC9MAhZQQd9egwWCxrwSIsJQ,OwbWQRPWHh0,HISTORY,Ancient Aliens: Tesla's Death Ray (Season 8) | History,100680,1061,47,0,90,PT3M31S
UC9MAhZQQd9egwWCxrwSIsJQ,SliqbvUtvos,HISTORY,American Pickers: BIG COLLECTION of VW Buses and BSA Motorcycles (Season 3) | History,99688,516,29,0,33,PT4M47S
UC9MAhZQQd9egwWCxrwSIsJQ,MHo10rwKWAg,HISTORY,The Curse of Oak Island: Rick Finds Evidence The Swamp Was Man-Made (Season 5) | History,174564,863,53,0,112,PT3M52S
UC9MAhZQQd9egwWCxrwSIsJQ,LSBG3Co-Pf0,HISTORY,Pawn Stars: Chumlee Knows His Kicks | History,539507,3924,182,0,275,PT5M7S
UC9MAhZQQd9egwWCxrwSIsJQ,SDKzVBv-xNI,HISTORY,Forged in Fire: Top 5 Axes in History Tested | Exclusive | History,409878,5097,94,0,139,PT5M13S
UC9MAhZQQd9egwWCxrwSIsJQ,1X2HW92V8wM,HISTORY,Swamp People: Troy's Boat Load of Big Gators (Season 8) | History,120328,1230,51,0,44,PT5M32S
UC9MAhZQQd9egwWCxrwSIsJQ,3y-xm6ADGTM,HISTORY,Forged in Fire: Naval Officer's Sword Final Round: Jerad vs Lee (Season 6) | History,2010602,19919,1097,0,709,PT10M16S
UC9MAhZQQd9egwWCxrwSIsJQ,qnN0s7AYiys,HISTORY,The Curse of Oak Island: Artifact Found at Lot 21 (Season 5) | History,117218,808,80,0,70,PT3M41S
UC9MAhZQQd9egwWCxrwSIsJQ,fhXKujzljfk,HISTORY,American Pickers: Big Gamble on a Cadillac Fleetwood (Season 9) | History,122040,632,38,0,43,PT4M56S
UC9MAhZQQd9egwWCxrwSIsJQ,-hN-eDJBt3o,HISTORY,The Curse of Oak Island: Historic Documents Uncovered in the Money Pit (Season 5) | History,123598,778,46,0,85,PT3M43S
UC9MAhZQQd9egwWCxrwSIsJQ,VGzl7XTtDPw,HISTORY,Ancient Aliens: Dinosaur Humanoids Alive Today? (Season 8) | History,267842,3147,223,0,464,PT3M7S
UC9MAhZQQd9egwWCxrwSIsJQ,CxDb2lKVdgQ,HISTORY,The UnXplained: Mystery of the Mothman (Season 1) | SERIES RETURNS 2/29 at 9/8c |  History,109218,1755,78,0,206,PT3M55S
UC9MAhZQQd9egwWCxrwSIsJQ,E15cHoBv40s,HISTORY,The Curse of Oak Island: Ancient Dumpsite Found! (Season 5) | History,104653,855,52,0,93,PT3M15S
UC9MAhZQQd9egwWCxrwSIsJQ,g5BI4GlYKK0,HISTORY,Swamp People: Huge Gator Answers Frenchy's Prayers (Season 8) | History,92340,969,47,0,33,PT5M22S
UC9MAhZQQd9egwWCxrwSIsJQ,hoVzfTPq7II,HISTORY,The UnXplained: The Most Haunted House in America (Season 1) | SERIES RETURNS 2/29 at 9/8c | History,1791311,27492,1118,0,2261,PT3M31S
UC9MAhZQQd9egwWCxrwSIsJQ,Y7d0A5re7-0,HISTORY,Vikings: Season 6 Official Trailer | History,3947830,31764,801,0,3056,PT2M50S
UC9MAhZQQd9egwWCxrwSIsJQ,fKBLeu4dnX8,HISTORY,American Pickers: Harley Honey Hole in a Huge Barn (Season 5) | History,184966,837,58,0,26,PT4M21S
UC9MAhZQQd9egwWCxrwSIsJQ,IY3OXWHEpHU,HISTORY,Ancient Aliens: Alien Technology and the Walls of Jericho (Season 8) | History,169507,1480,102,0,240,PT3M48S
UC9MAhZQQd9egwWCxrwSIsJQ,YBRrQqDhj28,HISTORY,Ancient Aliens: The Tomb of the Alien Pharaoh (Season 12) | History,134502,1599,54,0,130,PT3M13S
UC9MAhZQQd9egwWCxrwSIsJQ,EPVazUPKBVA,HISTORY,Forged in Fire: Greek Kopis Final Round: Mike vs. John (Season 6) | History,1548852,14325,392,0,502,PT10M19S
UC9MAhZQQd9egwWCxrwSIsJQ,pLKGo5MZSOE,HISTORY,Kings of Pain: Outrageous Python Bite Leaves Adam Bloody | Series Premieres Nov. 12 10/9c | HISTORY,1436141,4518,800,0,763,PT2M25S
UC9MAhZQQd9egwWCxrwSIsJQ,0M1t3RzS42U,HISTORY,The Curse of Oak Island: FASCINATING FIND Revealed by Lab Tests (Season 5) | History,145146,901,52,0,120,PT3M48S
UC9MAhZQQd9egwWCxrwSIsJQ,wZbN6zhO2ho,HISTORY,Swamp People: Gator Redemption for Chase (Season 8) | History,93241,981,40,0,32,PT5M22S
UC9MAhZQQd9egwWCxrwSIsJQ,N6earwZSHRo,HISTORY,American Pickers: Classic Cars Blow Mike Away (Season 20) | Exclusive | History,116569,576,88,0,49,PT2M34S
UC9MAhZQQd9egwWCxrwSIsJQ,kZyNMqcpFm8,HISTORY,Unidentified: Naval Pilots Witness UFOs (Season 1) | History,1211077,15647,534,0,2883,PT7M43S
UC9MAhZQQd9egwWCxrwSIsJQ,bXPqvi4OHig,HISTORY,EDDIE THE BEAST HALL: STRONGMAN'S TOUGHEST LIFTS | The Strongest Man in History (Season 1) | History,727095,10919,191,0,575,PT12M6S
UC9MAhZQQd9egwWCxrwSIsJQ,KBnYPqfktYs,HISTORY,Ancient Aliens: Extraterrestrial Bacteria and the Origins of Life (Season 9) | History,140878,1538,49,0,176,PT3M39S
UC9MAhZQQd9egwWCxrwSIsJQ,NIEQMk5KgFY,HISTORY,The Curse of Oak Island: Evidence of Pirate Ship Wharf (Season 5) | History,73615,659,38,0,61,PT3M22S
UC9MAhZQQd9egwWCxrwSIsJQ,Uuv6TPm0JDQ,HISTORY,UFO Hunters: UFO Sighting in Triangle Alley (Season 3) | History,127483,1545,93,0,378,PT5M32S
UC9MAhZQQd9egwWCxrwSIsJQ,LdjOjT81pN8,HISTORY,American Pickers: Rare '55 T-Bird in Vintage Ford Collection (Season 20) | Exclusive | History,67615,336,35,0,20,PT2M35S
UC9MAhZQQd9egwWCxrwSIsJQ,GfyWeHUuI7g,HISTORY,Ancient Aliens: What is the Ark of the Covenant's True Purpose? (Season 9) | History,325162,3907,235,0,561,PT3M32S
UC9MAhZQQd9egwWCxrwSIsJQ,tZBW6GTwQ3U,HISTORY,Ancient Aliens: Egypt's Alien Coffins (Season 12) | Exclusive | History,158832,2028,101,0,203,PT3M15S
UC9MAhZQQd9egwWCxrwSIsJQ,dbxMICf5Z1U,HISTORY,BRIAN SHAW'S WORLD RECORD 733 LB STONE LIFT | The Strongest Man in History | History,4682669,60348,1233,0,4247,PT5M56S
UC9MAhZQQd9egwWCxrwSIsJQ,Bka_wdtgRvI,HISTORY,The Curse of Oak Island: Unbelievable Find at Lot 16 (Season 5) | History,167305,1147,83,0,91,PT5M11S
UC9MAhZQQd9egwWCxrwSIsJQ,iTrSXm5-bV4,HISTORY,Forged in Fire: Barbarian Sword Tests (Season 6) | History,2056787,23386,569,0,545,PT5M5S
UC9MAhZQQd9egwWCxrwSIsJQ,6IvNtXYK4QA,HISTORY,American Pickers: Mike's Mega-Pick Freak Out Over Massive Car Collection (Season 11) | History,241368,1344,71,0,75,PT5M7S
UC9MAhZQQd9egwWCxrwSIsJQ,SIuJMNmIPLw,HISTORY,STRONGMEN VS. SCOTSMEN IN EPIC TUG-OF-WAR | The Strongest Man in History (Season 1) | History,9466357,100781,4016,0,2955,PT7M16S
UC9MAhZQQd9egwWCxrwSIsJQ,PxcHZNDC1bc,HISTORY,Mountain Men: Forging an Ozark Steel Blade (Season 8) | History,150580,1468,47,0,99,PT5M36S
UC9MAhZQQd9egwWCxrwSIsJQ,XNILsttsOrw,HISTORY,Ax Men: Close Call With a Widowmaker Almost Kills Dwayne (Season 10) | History,181016,1451,79,0,114,PT5M16S
UC9MAhZQQd9egwWCxrwSIsJQ,0qC64jGCxBo,HISTORY,Forged in Fire: The O-Katana Tests (Season 6) | History,4742589,47939,1676,0,1168,PT4M57S
UC9MAhZQQd9egwWCxrwSIsJQ,8iSt-EKPMZk,HISTORY,The Strongest Man in History: Eddie Hall Carries a 600 Pound Piano (Season 1) | History,2748460,30387,669,0,1374,PT5M18S
UC9MAhZQQd9egwWCxrwSIsJQ,cmDUcj4mJ0o,HISTORY,Ancient Aliens: Is Mount Kailish an Ancient Nuclear Power Plant? (Season 9) | History,324969,5190,225,0,450,PT5M24S
UC9MAhZQQd9egwWCxrwSIsJQ,BTIa_x0k7HA,HISTORY,Forged in Fire: Top 5 Strongest Pole Weapons in History | History,137511,2037,45,0,51,PT4M26S
UC9MAhZQQd9egwWCxrwSIsJQ,VQZ0eTNXwMU,HISTORY,Ax Men: Dangerous Game of Tree Dominoes (Season 10) | History,205957,1570,122,0,109,PT6M14S
UC9MAhZQQd9egwWCxrwSIsJQ,ypHNy2-JC-Q,HISTORY,Ancient Aliens: India's Flying Saucers (Season 12) | Exclusive | History,476135,11906,519,0,1653,PT3M3S
UC9MAhZQQd9egwWCxrwSIsJQ,-_hDVwygQ4s,HISTORY,Ancient Aliens: Tesla's Interstellar Communications (Season 9) | History,739230,10139,330,0,796,PT5M21S
UC9MAhZQQd9egwWCxrwSIsJQ,vuJcsQYyDBU,HISTORY,Ax Men: Rygaard's Risky Plan to Keep the Wood Moving (Season 10) | History,70502,510,31,0,40,PT5M14S
UC9MAhZQQd9egwWCxrwSIsJQ,qUV5hhPjmKU,HISTORY,Forged in Fire: Canister Damascus Knife Tests (Season 6) | History,247474,2357,58,0,65,PT5M11S
UC9MAhZQQd9egwWCxrwSIsJQ,w_um_wYk0ig,HISTORY,American Pickers: Rocket Car With a Real Jet Engine (Season 12) | History,117207,782,43,0,31,PT5M25S
UC9MAhZQQd9egwWCxrwSIsJQ,6K_kM1n8DfY,HISTORY,Ancient Aliens: Secrets of the Serpeant Mound (Season 9) | History,182970,2223,92,0,215,PT5M17S
UC9MAhZQQd9egwWCxrwSIsJQ,CV70OZrenmI,HISTORY,Forged In Fire: Top 5 Strongest Chinese Blades in History Tested | History,384179,4741,113,0,120,PT4M32S
UC9MAhZQQd9egwWCxrwSIsJQ,YFjNO9EDY6Y,HISTORY,Swamp People: A Monster Haul for Frenchy and Gee (Season 10) | History,173803,1089,70,0,25,PT5M17S
UC9MAhZQQd9egwWCxrwSIsJQ,McS9O2p447c,HISTORY,Paul Anderson's 402 Pound Overhead Press: The Strongest Man in History (Season 1) | History,2958339,33773,660,0,2341,PT5M14S
UC9MAhZQQd9egwWCxrwSIsJQ,d_mTsX6jovc,HISTORY,Ancient Aliens: The Tower of Babel (Season 9) | History,800486,10583,720,0,1212,PT5M10S
UC9MAhZQQd9egwWCxrwSIsJQ,PDNyiRLH-zo,HISTORY,Swamp People: Willie Tags Out with Colossal Gator (Season 10) | History,711060,4861,221,0,163,PT5M18S
UC9MAhZQQd9egwWCxrwSIsJQ,belndKrefOY,HISTORY,Forged in Fire: Jambiya Dagger Tests (Season 6) | History,811422,6086,197,0,146,PT5M28S
UC9MAhZQQd9egwWCxrwSIsJQ,X5Wwffou8p0,HISTORY,American Pickers: A Crazy Expensive Collection of Nash Healey Cars (Season 13) | History,149023,842,34,0,55,PT5M19S
UC9MAhZQQd9egwWCxrwSIsJQ,5-TMI0tHl7k,HISTORY,American Pickers: Picking a Man Cave of Rare Cars (Season 12) | History,231683,1191,58,0,47,PT5M23S
UC9MAhZQQd9egwWCxrwSIsJQ,sBraOwJHk6w,HISTORY,The Curse of Oak Island: An Unbelievable Find in the Spoils Pile (Season 6) | History,269022,1626,131,0,152,PT4M41S
UC9MAhZQQd9egwWCxrwSIsJQ,I_0YqdL_TPs,HISTORY,Ancient Aliens: The Great Mayan Disappearance (Season 9) | History,1085143,9429,501,0,1324,PT5M14S
UC9MAhZQQd9egwWCxrwSIsJQ,GWzsdD-0rpc,HISTORY,Ax Men: Danger on the Mountainside (Season 10) | History,203851,1248,65,0,88,PT5M21S
UC9MAhZQQd9egwWCxrwSIsJQ,q4WpVLfc4q8,HISTORY,Ancient Aliens: Electromagnetic Power Grid Inside the Pyramids (Season 9) | History,786936,8201,457,0,967,PT5M14S
UC9MAhZQQd9egwWCxrwSIsJQ,vKraDlqZhhk,HISTORY,The Curse of Oak Island: New Evidence of the Original Money Pit (Season 6) | History,344446,2063,139,0,225,PT5M38S
UC9MAhZQQd9egwWCxrwSIsJQ,6CY3puQ_D0A,HISTORY,The Strongest Man in History: Swimming Challenge | Exclusive | History,3412531,41995,929,0,2242,PT3M29S
UC9MAhZQQd9egwWCxrwSIsJQ,2JJeGKPREAg,HISTORY,Ancient Aliens: Indonesia's Lost Pyramids (Season 9) | History,997461,14121,476,0,2128,PT4M44S
UC9MAhZQQd9egwWCxrwSIsJQ,ydT3EB0WKxY,HISTORY,American Pickers: Lincoln Zephyr Barn Find (Season 20) | History,192794,1066,43,0,66,PT4M55S
UC9MAhZQQd9egwWCxrwSIsJQ,bgJOCGCVmAI,HISTORY,Ancient Aliens: Alien Visions of the Founding Fathers (Season 9) | History,128574,1663,124,0,130,PT4M55S
UC9MAhZQQd9egwWCxrwSIsJQ,bNeeCeY5nWU,HISTORY,Mountain Men: Hunting Down A Brown Bear (Season 8) | History,332680,2407,398,0,279,PT6M19S
UC9MAhZQQd9egwWCxrwSIsJQ,mGgVGQXp_14,HISTORY,Alone: The Moose Kill (Season 6) | History,108026,908,72,0,303,PT4M41S
UC9MAhZQQd9egwWCxrwSIsJQ,AStKrnjfpUk,HISTORY,The Strongest Man in History: Mast Lift Challenge | Exclusive | History,2267855,26779,709,0,1266,PT6M
UC9MAhZQQd9egwWCxrwSIsJQ,WBla3IdU_8w,HISTORY,"American Pickers: An Owner Wants $80,000 for a Classic Auburn Car (Season 12) | History",232381,1401,67,0,125,PT5M3S
UC9MAhZQQd9egwWCxrwSIsJQ,T8WdKsZ1fYw,HISTORY,The Strongest Man in History: Thor's Hammer Throw | Exclusive | History,2288131,31250,1016,0,1241,PT2M48S
UC9MAhZQQd9egwWCxrwSIsJQ,WRvSpodZPkk,HISTORY,American Pickers: Motorcycle Mega Pick in West Virginia (Season 12) | History,387273,2211,107,0,88,PT5M13S
UC9MAhZQQd9egwWCxrwSIsJQ,4bmtlX7Z-jc,HISTORY,The Curse of Oak Island: Another Key Discovery at the H-8 Shaft (Season 6) | History,131730,940,70,0,79,PT3M48S
UC9MAhZQQd9egwWCxrwSIsJQ,hCFRjzuT6IU,HISTORY,Forged in Fire: Canister Damascus Knife Tests (Season 5) | History,348498,2644,101,0,86,PT5M12S
UC9MAhZQQd9egwWCxrwSIsJQ,nR1sZDWFUPw,HISTORY,Swamp People: Alligator Garfish Hunt with the Landrys (Season 10) | History,330377,2115,94,0,51,PT4M55S
UC9MAhZQQd9egwWCxrwSIsJQ,FCGN0YxMMuo,HISTORY,Mountain Men: Mike Runs Into Bear Trouble (Season 8) | History,503883,3115,207,0,190,PT5M42S
UC9MAhZQQd9egwWCxrwSIsJQ,qOy16JM9_U4,HISTORY,Forged in Fire: Steel Takedown Bow Tests (Season 5) | History,2351042,18484,916,0,666,PT5M14S
UC9MAhZQQd9egwWCxrwSIsJQ,A044OD3e89E,HISTORY,Swamp People: Willie Battles a Monster Gator (Season 10) | History,203919,1628,74,0,101,PT5M12S
UC9MAhZQQd9egwWCxrwSIsJQ,NYNpvbnYmr8,HISTORY,Forged in Fire: Storage Unit Steel Knife Tests (Season 5) | History,593498,4759,146,0,161,PT5M11S
UC9MAhZQQd9egwWCxrwSIsJQ,rX-JBDRnrvA,HISTORY,Ancient Aliens: Alien Ideas That Changed Human History (Season 9) | History,324412,3867,188,0,336,PT5M7S
UC9MAhZQQd9egwWCxrwSIsJQ,54Mt2nmCYEk,HISTORY,Forged in Fire: The Grim Reaper's Scythe Tests (Season 5) | History,9023970,99254,3819,0,3293,PT5M11S
UC9MAhZQQd9egwWCxrwSIsJQ,Mf7Y5A9Mkps,HISTORY,Mountain Men: Tom and Sean Set the First Beaver Trap (Season 8) | History,111555,940,50,0,57,PT5M54S
UC9MAhZQQd9egwWCxrwSIsJQ,N0KD8VNcs1o,HISTORY,Mountain Men: Eustace and Raleigh Send Trespassers a Message (Season 8) | History,388967,2836,190,0,226,PT5M17S
UC9MAhZQQd9egwWCxrwSIsJQ,nAhFM97fIwE,HISTORY,Swamp People: Troy's Got Gun Trouble (Season 10) | History,127980,936,37,0,40,PT4M26S
UC9MAhZQQd9egwWCxrwSIsJQ,ZS8w4m9_N9Y,HISTORY,American Pickers: Michigan Madman (Season 18) | Bonus | History,332476,1692,79,0,115,PT3M14S
UC9MAhZQQd9egwWCxrwSIsJQ,tvY-SNhuHS0,HISTORY,Forged in Fire: Metal Sculpture Damascus Steel Tests (Season 5) | History,690977,5255,145,0,118,PT5M2S
UC9MAhZQQd9egwWCxrwSIsJQ,ana9Do3om3A,HISTORY,Swamp People: Troy Chases a Gator on the Riverbank (Season 10) | History,103171,819,47,0,30,PT3M38S
UC9MAhZQQd9egwWCxrwSIsJQ,ItCToOs_maQ,HISTORY,The Curse of Oak Island: A Significant Wood Sample at Bore Hole K-5.5 (Season 6) | History,140153,899,68,0,101,PT4M36S
UC9MAhZQQd9egwWCxrwSIsJQ,PDx7EV3p7o4,HISTORY,Unidentified: Inside America's UFO Investigation | Aware We Are There | Fri May 31 10/9c | HISTORY,101856,641,40,0,213,PT43S
UC9MAhZQQd9egwWCxrwSIsJQ,dmswoeirImg,HISTORY,The Curse of Oak Island: Actual Treasure Found at Smith's Cove (Season 6) | History,996345,3176,555,0,452,PT4M13S
